{
  "packet_id": "XPK-QUERY-0708-3",
  "packet_type": "query_result",
  "created_at": "2026-07-08T01:00:00Z",
  "source_query": {
    "command": "export-query --status open --severity critical",
    "filters": {"status": "open", "severity": "critical"},
    "item_count": 2
  },
  "item_ids": ["QA-QUERY-1000", "QA-QUERY-2000"],
  "included_items": [
    {
      "qa_item_id": "QA-QUERY-1000",
      "title": "Item with evidence",
      "source": "evidence_intake",
      "status": "open",
      "severity": "critical",
      "category": "security",
      "description": "Critical security finding.",
      "evidence_refs": [],
      "evidence_links": [{"evidence_link_id":"EL-FIX-1000-001","evidence_type":"validator_output","evidence_ref":"EP-TEST-001","attachment_reason":"Evidence of finding","custody":"qa-pilot-local","advisory_only":true,"authority_note":"Evidence attachment does not prove defect validity or imply Owner approval.","attached_at":"2026-07-08T00:00:00Z"}],
      "lifecycle_history": [{"from_status":"__init__","to_status":"open","transition_reason":"Created","actor":"agent","timestamp":"2026-07-08T00:00:00Z","advisory_only":true}],
      "owner_decision_state": "pending",
      "created_at": "2026-07-08T00:00:00Z",
      "updated_at": "2026-07-08T00:00:00Z",
      "advisory_only": true, "custody": "qa-pilot-local", "librarian_impact": "none"
    },
    {
      "qa_item_id": "QA-QUERY-2000",
      "title": "Second critical finding",
      "source": "evidence_intake",
      "status": "open",
      "severity": "critical",
      "category": "security",
      "description": "Another critical security finding.",
      "evidence_refs": [],
      "evidence_links": [],
      "lifecycle_history": [{"from_status":"__init__","to_status":"open","transition_reason":"Created","actor":"agent","timestamp":"2026-07-08T00:00:00Z","advisory_only":true}],
      "owner_decision_state": "pending",
      "created_at": "2026-07-08T00:00:00Z",
      "updated_at": "2026-07-08T00:00:00Z",
      "advisory_only": true, "custody": "qa-pilot-local", "librarian_impact": "none"
    }
  ],
  "evidence_links_aggregate": {"total_links": 1, "by_type": {"validator_output": 1}},
  "lifecycle_summary": {"total_transitions": 2, "by_status": {"open": 2}},
  "validator_summary": null,
  "authority_disclaimer": "This export packet is advisory-only. It does not verify item correctness, imply defect acceptance, imply Owner approval, or close/seal/promote QA items. Custody is qa-pilot-local. Librarian impact is none.",
  "custody": "qa-pilot-local",
  "advisory_only": true,
  "librarian_impact": "none"
}
